{
  "id": "dpl_8FQk2zR4nXyVbN1k",
  "name": "marketing-site",
  "platform": "vercel",
  "environment": "production",
  "source": {
    "repository": "https://github.com/acme/marketing-site",
    "branch": "main",
    "commit_sha": "9c1d4a3f8e7b2c5a6f0d1e3b4c8a7f9e0d2b1c5a"
  },
  "url": "https://www.acme.com",
  "status": "ready",
  "build": {
    "build_id": "bld_4f7a9c2d1e8b6f0a",
    "duration_seconds": 47,
    "image": "registry.example.com/marketing-site:9c1d4a3"
  },
  "created_at": "2026-05-19T10:14:00Z",
  "promoted_to_production_at": "2026-05-19T10:22:00Z"
}
